{"meta":{"generated_at":"2026-09-29T20:04:27.043867Z"},"stages":[{"id":"pop","name":"Population","symbol":"P","prior_summary":"GHS-POP 100 m, 500 m buffer","provenance_key":"prior:population"},{"id":"cons","name":"Consumption","symbol":"C","prior_summary":"DDD/1000 inh/day, national data","provenance_key":"prior:consumption"},{"id":"excr","name":"Excretion","symbol":"fe","prior_summary":"Per-drug excretion fraction","provenance_key":"prior:excretion"},{"id":"load","name":"Mass load","symbol":"M","prior_summary":"g/day entering stream","provenance_key":"prior:lambda"},{"id":"dil","name":"Dilution","symbol":"Q","prior_summary":"m³/s log-uniform by size class","provenance_key":"prior:Q"},{"id":"pec","name":"PEC","symbol":"PEC","prior_summary":"ng/L after in-stream loss","provenance_key":"prior:tau"},{"id":"rq","name":"RQ","symbol":"RQ","prior_summary":"PEC ÷ PNEC","provenance_key":"prior:pnec"}],"priors_table":[{"param":"λ (leakage)","distribution":"loguniform","range":"0.002–0.15","unit":"fraction","status":"assumption","source_url":null,"shape":"log-uniform"},{"param":"Q (S class)","distribution":"loguniform","range":"0.005–0.1","unit":"m³/s","status":"assumption","source_url":null,"shape":"log-uniform"},{"param":"Q (M class)","distribution":"loguniform","range":"0.02–0.5","unit":"m³/s","status":"assumption","source_url":null,"shape":"log-uniform"},{"param":"Q (L class)","distribution":"loguniform","range":"0.1–2.0","unit":"m³/s","status":"assumption","source_url":null,"shape":"log-uniform"},{"param":"τ (travel time)","distribution":"uniform","range":"0.5–12","unit":"hours","status":"assumption","source_url":null,"shape":"uniform"},{"param":"C multiplier","distribution":"loguniform","range":"0.5–2.0","unit":"dimensionless","status":"assumption","source_url":null,"shape":"log-uniform"}],"identifiability_text":"The model has three unidentifiable parameters per site: λ (leakage fraction), Q (stream flow), and τ (travel time). These are drawn from prior distributions informed by published sewer-leakage studies and OSM stream geometry. The sensitivity analysis (Spearman ρ) identifies which prior dominates the score uncertainty at each site. Parameters informed by measured data (DDD, fe, PNEC, LOD) reduce uncertainty only when sourced. With illustrative parameters (D33), the model demonstrates the pipeline mechanism only — scores are not evidence of actual risk.","ablations":{"variants":["full","pop_only","wwtp_only"],"per_city":[{"city":"BNV","variant":"full","ranking":["BNV-07","BNV-05","BNV-20","BNV-15","BNV-21","BNV-11","BNV-02","BNV-01","BNV-19","BNV-14","BNV-03","BNV-09","BNV-06","BNV-10","BNV-08","BNV-04","BNV-12","BNV-13","BNV-16","BNV-17","BNV-18"]},{"city":"CBR","variant":"full","ranking":["CBR-11","CBR-04","CBR-20","CBR-07","CBR-12","CBR-03","CBR-08","CBR-09","CBR-13","CBR-21","CBR-10","CBR-15","CBR-16","CBR-01","CBR-02","CBR-05","CBR-06","CBR-14","CBR-17","CBR-18","CBR-19"]},{"city":"GNT","variant":"full","ranking":["GNT-05","GNT-02","GNT-11","GNT-12","GNT-21","GNT-13","GNT-09","GNT-15","GNT-08","GNT-06","GNT-20","GNT-01","GNT-10","GNT-18","GNT-16","GNT-19","GNT-14","GNT-07","GNT-03","GNT-17","GNT-04"]},{"city":"OSL","variant":"full","ranking":["OSL-08","OSL-02","OSL-12","OSL-09","OSL-16","OSL-01","OSL-20","OSL-14","OSL-18","OSL-21","OSL-05","OSL-13","OSL-06","OSL-07","OSL-17","OSL-03","OSL-19","OSL-04","OSL-10","OSL-11","OSL-15"]},{"city":"TLS","variant":"full","ranking":["TLS-12","TLS-10","TLS-20","TLS-01","TLS-15","TLS-21","TLS-17","TLS-08","TLS-11","TLS-02","TLS-14","TLS-04","TLS-07","TLS-09","TLS-16","TLS-06","TLS-13","TLS-03","TLS-18","TLS-05","TLS-19"]},{"city":"BNV","variant":"pop_only","ranking":["BNV-07","BNV-05","BNV-20","BNV-15","BNV-21","BNV-11","BNV-02","BNV-19","BNV-01","BNV-14","BNV-03","BNV-09","BNV-06","BNV-10","BNV-08","BNV-04","BNV-12","BNV-13","BNV-16","BNV-17","BNV-18"]},{"city":"CBR","variant":"pop_only","ranking":["CBR-11","CBR-04","CBR-20","CBR-07","CBR-12","CBR-03","CBR-08","CBR-09","CBR-13","CBR-21","CBR-10","CBR-15","CBR-16","CBR-01","CBR-02","CBR-05","CBR-06","CBR-14","CBR-17","CBR-18","CBR-19"]},{"city":"GNT","variant":"pop_only","ranking":["GNT-05","GNT-02","GNT-11","GNT-12","GNT-21","GNT-13","GNT-09","GNT-15","GNT-08","GNT-06","GNT-20","GNT-01","GNT-10","GNT-18","GNT-16","GNT-19","GNT-14","GNT-07","GNT-03","GNT-17","GNT-04"]},{"city":"OSL","variant":"pop_only","ranking":["OSL-08","OSL-02","OSL-12","OSL-09","OSL-16","OSL-01","OSL-20","OSL-14","OSL-18","OSL-21","OSL-05","OSL-13","OSL-06","OSL-07","OSL-17","OSL-03","OSL-19","OSL-04","OSL-10","OSL-11","OSL-15"]},{"city":"TLS","variant":"pop_only","ranking":["TLS-12","TLS-10","TLS-20","TLS-01","TLS-21","TLS-15","TLS-17","TLS-08","TLS-11","TLS-02","TLS-14","TLS-04","TLS-07","TLS-09","TLS-16","TLS-06","TLS-13","TLS-03","TLS-18","TLS-05","TLS-19"]},{"city":"BNV","variant":"wwtp_only","ranking":["BNV-01","BNV-02","BNV-03","BNV-04","BNV-05","BNV-06","BNV-07","BNV-08","BNV-09","BNV-10","BNV-11","BNV-12","BNV-13","BNV-14","BNV-15","BNV-16","BNV-17","BNV-18","BNV-19","BNV-20","BNV-21"]},{"city":"CBR","variant":"wwtp_only","ranking":["CBR-01","CBR-02","CBR-03","CBR-04","CBR-05","CBR-06","CBR-07","CBR-08","CBR-09","CBR-10","CBR-11","CBR-12","CBR-13","CBR-14","CBR-15","CBR-16","CBR-17","CBR-18","CBR-19","CBR-20","CBR-21"]},{"city":"GNT","variant":"wwtp_only","ranking":["GNT-01","GNT-02","GNT-03","GNT-04","GNT-05","GNT-06","GNT-07","GNT-08","GNT-09","GNT-10","GNT-11","GNT-12","GNT-13","GNT-14","GNT-15","GNT-16","GNT-17","GNT-18","GNT-19","GNT-20","GNT-21"]},{"city":"OSL","variant":"wwtp_only","ranking":["OSL-01","OSL-02","OSL-03","OSL-04","OSL-05","OSL-06","OSL-07","OSL-08","OSL-09","OSL-10","OSL-11","OSL-12","OSL-13","OSL-14","OSL-15","OSL-16","OSL-17","OSL-18","OSL-19","OSL-20","OSL-21"]},{"city":"TLS","variant":"wwtp_only","ranking":["TLS-01","TLS-02","TLS-03","TLS-04","TLS-05","TLS-06","TLS-07","TLS-08","TLS-09","TLS-10","TLS-11","TLS-12","TLS-13","TLS-14","TLS-15","TLS-16","TLS-17","TLS-18","TLS-19","TLS-20","TLS-21"]}]}}